{
  "$schema": "https://json-schema.org/draft/2020-12/schema",
  "$id": "https://soustack.spec/soustack.schema.json",
  "title": "Soustack Specification",
  "type": "object",
  "properties": {
    "$schema": { "type": "string", "const": "https://soustack.spec/soustack.schema.json" },
    "level": { "type": "string", "enum": ["lite", "base"] },
    "stacks": {
      "type": "array",
      "items": { "$ref": "./defs/common.schema.json#/properties/stackId" },
      "uniqueItems": true
    },
    "name": { "type": "string" },
    "yield": {
      "type": "object",
      "properties": {
        "amount": { "type": "number", "exclusiveMinimum": 0 },
        "unit": { "type": "string", "minLength": 1 },
        "metadata": { "type": "object", "additionalProperties": true }
      },
      "required": ["amount", "unit"],
      "additionalProperties": false,
      "patternProperties": {
        "^x-": { "$ref": "./defs/common.schema.json#/properties/extensionLaneValue" }
      }
    },
    "time": {
      "type": "object",
      "properties": {
        "total": { "$ref": "./defs/duration.schema.json#/properties/DurationMinutes" },
        "metadata": { "type": "object", "additionalProperties": true }
      },
      "required": ["total"],
      "additionalProperties": false,
      "patternProperties": {
        "^x-": { "$ref": "./defs/common.schema.json#/properties/extensionLaneValue" }
      }
    },
    "ingredients": {
      "type": "array",
      "items": {
        "anyOf": [
          { "type": "string" },
          { "$ref": "#/$defs/ingredient" },
          { "$ref": "#/$defs/ingredientSection" }
        ]
      }
    },
    "instructions": {
      "type": "array",
      "items": {
        "anyOf": [
          { "type": "string" },
          { "$ref": "#/$defs/step" },
          { "$ref": "#/$defs/stepSection" }
        ]
      }
    },
    "metadata": { "type": "object", "additionalProperties": true },
    "images": { "type": "array", "items": { "$ref": "./defs/common.schema.json#/properties/uri" } },
    "videos": { "type": "array", "items": { "$ref": "./defs/common.schema.json#/properties/uri" } },
    "dietary": { "$ref": "./stacks/dietary.schema.json#/properties/dietary" },
    "storage": { "$ref": "./stacks/storage.schema.json#/properties/storage" },
    "substitutions": { "$ref": "./stacks/substitutions.schema.json#/properties/substitutions" },
    "techniques": { "$ref": "./stacks/techniques.schema.json#/properties/techniques" },
    "temperatures": { "$ref": "./stacks/temperature.schema.json#/properties/temperatures" }
  },
  "patternProperties": {
    "^x-": { "$ref": "./defs/common.schema.json#/properties/extensionLaneValue" }
  },
  "required": ["level", "stacks", "name", "ingredients", "instructions"],
  "allOf": [
    {
      "if": { "properties": { "level": { "const": "base" } } },
      "then": { "required": ["yield", "time"] }
    },
    {
      "if": { "properties": { "stacks": { "contains": { "const": "quantified" } } } },
      "then": {
        "properties": {
          "ingredients": { "$ref": "./stacks/quantified.schema.json#/properties/ingredients" }
        },
        "required": ["ingredients"]
      }
    },
    {
      "if": { "properties": { "stacks": { "contains": { "const": "structured" } } } },
      "then": {
        "properties": {
          "instructions": { "$ref": "./stacks/structured.schema.json#/properties/instructions" }
        }
      }
    },
    {
      "if": { "properties": { "stacks": { "contains": { "const": "timed" } } } },
      "then": {
        "properties": {
          "instructions": { "$ref": "./stacks/timed.schema.json#/properties/instructions" }
        }
      }
    },
    {
      "if": { "properties": { "stacks": { "contains": { "const": "referenced" } } } },
      "then": {
        "properties": {
          "ingredients": { "$ref": "./stacks/referenced.schema.json#/properties/ingredients" },
          "instructions": { "$ref": "./stacks/referenced.schema.json#/properties/instructions" }
        },
        "required": ["ingredients", "instructions"]
      }
    },
    {
      "if": { "properties": { "stacks": { "contains": { "const": "compute" } } } },
      "then": {
        "properties": {
          "level": { "const": "base" },
          "stacks": {
            "allOf": [
              { "contains": { "const": "quantified" } },
              { "contains": { "const": "timed" } }
            ]
          }
        }
      }
    },
    {
      "if": { "properties": { "stacks": { "contains": { "const": "storage" } } } },
      "then": { "required": ["storage"] }
    },
    {
      "if": { "properties": { "stacks": { "contains": { "const": "dietary" } } } },
      "then": { "required": ["dietary"] }
    },
    {
      "if": { "properties": { "stacks": { "contains": { "const": "substitutions" } } } },
      "then": { "required": ["substitutions"] }
    },
    {
      "if": { "properties": { "stacks": { "contains": { "const": "techniques" } } } },
      "then": { "required": ["techniques"] }
    }
  ],
  "unevaluatedProperties": false,
  "$defs": {
    "ingredient": { "$ref": "./defs/entities.schema.json#/$defs/IngredientBase" },
    "ingredientSection": {
      "type": "object",
      "properties": {
        "section": { "type": "string" },
        "ingredients": {
          "type": "array",
          "items": {
            "anyOf": [
              { "type": "string" },
              { "$ref": "#/$defs/ingredient" },
              { "$ref": "#/$defs/ingredientSection" }
            ]
          }
        },
        "metadata": { "type": "object", "additionalProperties": true }
      },
      "required": ["section", "ingredients"],
      "additionalProperties": false,
      "patternProperties": {
        "^x-": { "$ref": "./defs/common.schema.json#/properties/extensionLaneValue" }
      }
    },
    "step": { "$ref": "./defs/entities.schema.json#/$defs/StepBase" },
    "stepSection": {
      "type": "object",
      "properties": {
        "section": { "type": "string" },
        "steps": {
          "type": "array",
          "items": {
            "anyOf": [
              { "type": "string" },
              { "$ref": "#/$defs/step" },
              { "$ref": "#/$defs/stepSection" }
            ]
          }
        },
        "metadata": { "type": "object", "additionalProperties": true }
      },
      "required": ["section", "steps"],
      "additionalProperties": false,
      "patternProperties": {
        "^x-": { "$ref": "./defs/common.schema.json#/properties/extensionLaneValue" }
      }
    }
  }
}
